filename	format	sequences	sites	source_or_derivation	source_sha256	local_sha256	transformation_status	role	notes
nextstrain_genbank_norovirus_full_genome_source_sequences_4565seq.fasta	fasta_unaligned_sequences	4565	NA	Hashed local snapshot derived from Nextstrain norovirus and GenBank records	58534d65206d0e8babcd4c0f76054f85c4f2d316e77d96eb85c8f90f3ec9068f	58534d65206d0e8babcd4c0f76054f85c4f2d316e77d96eb85c8f90f3ec9068f	copied_unchanged	Raw source sequence snapshot for the norovirus recombination workflow	Not an MSA; included here because it is the source sequence snapshot for regenerating the alignment.
norovirus_subsampled_mafft_alignment_334taxa.fasta	fasta_msa	334	8731	MAFFT alignment from the norovirus Augur-subsampled sequence set	3cfd94935b0a1f08a37d378fea7bd89d6f564fd494155ca7eadc2f1a9b268edf	3cfd94935b0a1f08a37d378fea7bd89d6f564fd494155ca7eadc2f1a9b268edf	copied_unchanged	Intermediate MAFFT MSA before final trimAl/gappyout publication alignment	Kept to show the alignment stage feeding the canonical trimmed MSA.
norovirus_trimmed_publication_alignment_334taxa_8058bp.fasta	fasta_msa	334	8058	trimAl gappyout canonical publication alignment	b91326820959eec0cefbaeb00da771f7f630fbab23b34c815215c0e3dcd1f31e	b91326820959eec0cefbaeb00da771f7f630fbab23b34c815215c0e3dcd1f31e	copied_unchanged	Canonical Phylo-Movies norovirus recombination alignment	Primary reader-facing norovirus MSA.
recan_working_subset_48taxa_8058bp.fasta	fasta_msa	48	8058	Derived subset rebuilt from the canonical 334-sequence alignment by the ReCAN workflow	328d4a7da01ae675def0a1fdec60aa0293fc6f4a86529b5db186e48ce582d699	328d4a7da01ae675def0a1fdec60aa0293fc6f4a86529b5db186e48ce582d699	copied_unchanged	ReCAN validation working subset for query MK753032_P16_GII-4	Derived validation input, not independent source data.
recan_focused_subset_6taxa_8058bp.fasta	fasta_msa	6	8058	Derived focused subset from the canonical 334-sequence alignment	ef8d81a38e524521ea52c3b9fe01ff817669c6401d9b84744f310361b3e9d608	ef8d81a38e524521ea52c3b9fe01ff817669c6401d9b84744f310361b3e9d608	copied_unchanged	Focused ReCAN subset retained for inspection	Derived validation input; not the promoted current ReCAN result source.
